<!ELEMENT formas (poligono+)>
<!ELEMENT poligono ((coordX,coordY)+ | nombre)>
<!ELEMENT coordX (#PCDATA)>
<!ELEMENT coordY (#PCDATA)>
<!ELEMENT nombre (#PCDATA)>

